[
  {
    "id": "character:mejiro-mcqueen",
    "name": "Mejiro McQueen",
    "aliases": [],
    "affinityGroups": [],
    "iconHashes": []
  },
  {
    "id": "character:special-week",
    "name": "Special Week",
    "aliases": [],
    "affinityGroups": [],
    "iconHashes": []
  },
  {
    "id": "character:tm-opera-o",
    "name": "T.M. Opera O",
    "aliases": [],
    "affinityGroups": [],
    "iconHashes": []
  }
]
